created_utc,full_link,num_comments,score,selftext,subreddit,title
1614266143,https://www.reddit.com/r/CryptoCurrency/comments/ls8s3x/ive_seen_a_lot_of_people_on_here_recently_asking/,156,85,"*Before I dive in, I will say that I've seen more and more people on here asking someone to explain what FTM is. As someone who has been invested in Fantom since early 2019, I will explain below what makes me excited about the project. This is not financial advice and, of course, DYOR.*

[Fantom](https://fantom.foundation) is a layer 1 smart contract platform that has recently received a lot more attention, with an astronomical rise of 14x in the last month.

**Why? Read below.**

Fantom is fast and cheap. Fantom confirms transactions in less than 2 seconds, and they cost a fraction of a cent, or $0.00001. 

**Andre Cronje built it**

[Andre Cronje](https://twitter.com/AndreCronjeTech), the genius developer behind [Yearn](https://yearn.finance) and many other DeFi products, coauthored the consensus algorithm of Fantom, called Lachesis. He’s still involved in the project and speaks to the team daily, overseeing the major updates and releases.

Moreover, he confirmed multiple times that when the bridges are ready, he will port his most popular dApps on Fantom since it’s faster and cheaper than Ethereum.

Even better, the other [he tweeted about what that will look like from a user experience standpoint.](https://twitter.com/AndreCronjeTech/status/1362263811386839043?s=19) Holy fuckballs this will be awesome.

**Fantom isn’t an Ethereum fork**

Unlike many other blockchains, Fantom is not a fork of Ethereum. It’s built from scratch using an innovative consensus algorithm designed for high performance and scalability.

**Fantom is fully compatible with Ethereum**

Fantom supports the Ethereum Virtual Machine.

What does it mean? Developers familiar with Ethereum can deploy their dApps on Fantom just as easily, using the same tools such as Truffle, Remix, and Metamask.

Their dApps will be much cheaper to deploy, maintain and interact with. The user experience is therefore drastically improved, also thanks to the almost instant confirmations.

**Fantom is interoperable**

The full Ethereum compatibility makes Fantom interoperable with Ethereum. Ren is building a bridge between the two networks to allow a seamless flow of assets back and forth. 

Fantom is a layer 1 platform that can serve as a layer 2 for Ethereum. In other words, it can help Ethereum scale, among many other things. 

Just the other day Andre [tweeted](https://twitter.com/AndreCronjeTech/status/1363983480674115584) that FTM was never meant to be an ETH killer, but ETH simply needs some load balancers to help out. What FTM is doing for ETH is going to be huge. 

**You can stake it to earn rewards** 

Fantom is a Proof-of-Stake network. It means that you can participate in securing the network by staking your FTM. But it doesn’t end there. You can choose for how long to lock up your tokens for and get rewarded accordingly; the longer you lock your FTM, the higher the rewards.
Furthermore, Fantom is the first network to introduce Liquid Staking. You can use the value of your staked FTM within the ecosystem. Massive. 

There is also a governance system where holders can vote on the changes of the protocol.

*Humble brag: I've been staking for almost 2 years and have earned over 100K FTM passively.*

**It has an all-in-one DeFi suite**

The team didn’t just build an incredible blockchain platform that is fast, scalable, and secure. They also created an all-in-one DeFi suite, [Fantom Finance](https://fantom.finance). DeFi users are used to jumping across different protocols and websites to trade, lend, borrow and farm. Fantom Finance solves all that.

Users can mint synthetic tokens (like on Synthetix), trade on an AMM dex (like on Uniswap), and borrow and lend tokens (like on Aave), all in one place, directly from the wallet. How cool is that?!

**It has already partnered with many recognized crypto projects**

Fantom partnered with:

-Chainlink

-Ren Protocol

-Band Protocol

-Injective Protocol

-Waves

-The Graph

-Ethereum Classic Labs

-Api3

-Ontology

-V-id

-Coti

And many more

**It is still undervalued in my opinion**

Fantom is sitting around a $2 billion market cap with a token price of $0.78. Despite its recent rise, Fantom is still vastly undervalued. Avalanche offers a similar tech, without the integrated DeFi suite, and it’s valued higher at $2.4b. Solana, a fast blockchain yet not compatible with EVM and slower than Fantom, is above $4b. Aave, a dApp on Ethereum that would represent a part of Fantom Finance (so a part of a dApp on the Fantom ecosystem), is valued just under $5b. The proper comparison should be made with Ethereum, valued at $188b. In my opinion, the potential growth for Fantom is another 3x in the short term and the sky is the limit long term.

**It has a passionate community and strong social presence**

The Fantom Marines are one of the best communities in crypto. They’re organized like a proper army. They’re knowledgeable, and their Twitter presence is a force of nature. They’re similar to the Link Marines. They act as one. Memes, articles, videos, gifs, you name it. They can do it all.

**It has multiple government pilot programs and partnerships**

If you're still with me, you made it to one of the most exciting parts. 

Fantom is reshaping the country of Afghanistan. They have not one, not two, not three, but **four** government live pilot programs with Afghanistan. The first one, launched in July 2020 with the Minister of Health of Afghanistan, leverages [blockchain technology for pharmaceutical supply chain tracking](https://finance.yahoo.com/news/fantom-blockchain-launch-smart-medicine-103000039.html) to combat counterfeit drugs. More recently, Fantom [partnered with DABS](https://finance.yahoo.com/news/fantom-launches-blockchain-pilot-afghanistan-100000458.html), the national energy company for Afghanistan, to build blockchain-based ERP and CRM systems. Another program involves [the Afghanistan Chamber of Commerce and Investment to implement blockchain tools for auditing and authentication purposes.](https://fantom.foundation/blog/acci-fantom-pilot-program/?__cf_chl_jschl_tk__=fc807837d997e590f21b20adb6972d65aa0369a9-1613695821-0-AQmeswbGk2HLX3Q8Q-7BSdgfFzEERILHjQwfIjI_4ThPyuotouz1gTAB1GkQzXnc37yf8Upy1dcT-QIq2o-DC_A8AqWg1bTnzpKA4fid5uMuF10xwOYNkEIbjtd3p8kWz_1jQKPJbaWuUqNeS5THXMsFuxLq4maJeXz0IRIujOIzYz9L_rv7j-aFwmhnYzSFGP57JC49WQTTmbc6Gk0Gl4aAcYqsb3zTtsEpKB_lWtDXZvCdOZXGFcv0BwfNKokJVb90SwSkYdILQjkYAwvTU-No_anIiZ9bvXnIu6dBM4MPZGIoV2NItRtwyQpcZcB6dIww7_VDu2T6_8jvO_iwiQUBKk2KotrDKTDtDuOz6DWU) The team aims to digitize the whole country of Afghanistan and ultimately build a national stock exchange on the Fantom blockchain. The latest pilot program is [with The Afghanistan National Standard Authority to use Fantom technology to issue national certifications.](https://fantom.foundation/blog/ansa-fantom-blockchain-issuance-program/) 

Also the announcement was very recently made that [The Ministry of Digital Transformation of Ukraine has signed a memorandum which provides for cooperation in creating a platform for the exchange of intellectual property based on the Fantom blockchain](https://www.president.gov.ua/en/news/ukrayinska-delegaciya-pid-golovuvannyam-volodimira-zelenskog-66549)

**It has a transparent and humble team**

The Fantom team is very transparent and humble. They communicate promptly - they have one of the most active [Twitter accounts in crypto](https://twitter.com/FantomFDN), they’re hard-working and as clear as they can be with the community. It almost feels like the team is part of the community. Besides their [official chat on Discord](https://chat.fantom.network), they also offer a support chat on their website, unheard of in crypto. Their Github is updated frequently, almost daily, and it’s easy to see what they’re working on at any given time.

**It’s getting integrated everywhere**

Besides centralized exchanges like Binance, Fantom is taking over the DeFi space. It’s listed on Uniswap, Sushiswap and 1inch. Just this week, Binance integrated FTM Opera Chain for deposits &amp; withdrawals. It’s just the beginning. We can speculate that once the Ren bridges are in place, there will be more integrations on Ethereum. We can think of Yearn, Curve, and all the biggest DeFi money markets.

**It’s on Coinbase Custody**

Coinbase Custody is the most important crypto custodian in the world and [it supports Fantom](https://twitter.com/CoinbaseInsto/status/1354563754713903110). Institutions and funds can now safely store their FTM with a trusted third party. It’s the first step to getting listed to Coinbase.

**Etherscan has built an explorer for them**

The Etherscan team has recently built [FTMScan](https://ftmscan.com), an explorer for Fantom. Previously, they only made Etherscan and an explorer for Binance. If that doesn’t tell you something, my friend, it’s on you.

And there you have it. I hope this helps paint a picture of why FTM has been shooting up the rankings. I still think there is a lot to come, but again, this is not financial advice. Good luck to all!",CryptoCurrency,I've seen a lot of people on here recently asking what Fantom is and why it's taking off. I hope this helps.
1614266071,https://www.reddit.com/r/CryptoCurrency/comments/ls8r43/people_who_bought_bitcoin_in_2017_becoming_the/,124,154,,CryptoCurrency,"People who bought Bitcoin in 2017 becoming the strongest HODLers, new data shows"
1614263204,https://www.reddit.com/r/CryptoCurrency/comments/ls7pd1/banks_suck/,120,98,"Was doing taxes and my bank sent me a 1099-T with my interest I earned for the year. I made $15 whole dollars in interest plus I still get to pay taxes on that. This brings two key thoughts to mind.

1) I am extremely poor 

2) It took me literally 365 days to earn $15 in interest, I could make more than $15 in crypto in 15 minutes


That is all,

ps. Thanks Yannet Jellen

Edit: Spelling and spacing",CryptoCurrency,Banks Suck
1614262881,https://www.reddit.com/r/CryptoCurrency/comments/ls7lla/crypto_youtubers_and_your_cringe_inducing/,582,614,"I’m so sick and tired of these YouTube crypto influencers using these god damn emoji click bait thumbnails.

Where is the credibility?! There is none. All of them are the same. They treat the entire crypto community as if we are a bunch of 15 year old kids popping adderall.

How will the outside view of crypto ever change when you can’t tell the difference between a crypto news article on YouTube and some 10 year old kids minecraft upload when both thumbnails look exactly the same. Sirens, emoji, stupid fonts, retarded shocked looking faces

It makes me cringe so much that these grown ass men are using thumbnails designed by kids to attract kids to shitty toy unveiling’s and reviews.

It’s time for serious streamers to drop this absolute trash approach to gaining followers.

I’ll tell you right now if I saw a streamer using a thumbnail with grown up adult content like clean images, intelligent font and no BS click bait I’ll be hitting that subscribe and smashing that like button...",CryptoCurrency,Crypto youtubers and your cringe inducing thumbnails... time for change!
1614294804,https://www.reddit.com/r/CryptoCurrency/comments/lsjq7n/the_usd_has_lost_well_over_90_of_its_purchasing/,82,52,"The Fed: ""Why do people not want our fake, corrupt, un-backed currency that we are printing an unlimited supply of and is designed to lose value as a means to redistribute wealth to the rich/corporations/government, and instead want this other un-backed, politically-neutral, digital currency supported by an immutable code that there is a limited supply of and that is designed to gain value?""

\[Yellen, you can get back to us on that when you have to some time to take a break from fixing all the fiat systems that broke down and went offline yesterday.\]",CryptoCurrency,The USD has lost well over 90% of its purchasing power since the Federal Reserve came into existence...
1614291594,https://www.reddit.com/r/CryptoCurrency/comments/lsijro/reddit_moons_have_paid_for_my_bills_two_months_in/,1281,839,"Sorry if this seems like a silly post but I am absolutely blown away that my comments and posts on this subreddit are paying my bills. 

I tried to explain this to my parents and a couple of friends but they couldn't get their head around it, they still think I'm some crazy bitcoin investor who is gambling his money like a mad man.

The whole reddit moon concept is genius and I am truly impressed at how the community has handled it so far especially with the ability to vote on key issues and how they are distributed.

I guess all I can say is thank you and I hope they are all helping you as much as they are me!

Edit - people have asked what moons are so I have copied and pasted a summary i wrote a while back as a reply in the comments",CryptoCurrency,Reddit Moons have paid for my bills two months in a row now. I literally cannot believe Internet memes are covering living costs!
1614290146,https://www.reddit.com/r/CryptoCurrency/comments/lsi04n/banano_is_like_dogecoin_but_actually_fun/,204,93,"i just joined the subreddit r/banano and it really reminds me of how needed it is to have a fun and lighthearted ACTIVE meme coin in the world of crypto. their folding@home stuff etc, really a good and silly project supporting good causes i would encourage everyone here to at least give a glance to.",CryptoCurrency,Banano is like Dogecoin but actually fun.
1614327245,https://www.reddit.com/r/CryptoCurrency/comments/lst48u/found_my_old_walletdat_circa_2012_year_on_my_flash/,214,68,"So, basically this. Don't remember that I've even had it or if there anything on it. Launched BitCoin Core to synchronise. Hope there ain't a password :)

Will try to open it in a seven hours or so. Doubt I have even a single bitcoin there, but... You never know. So... wish me luck, guys :)

By the way... I wonder how many millions in bitcoin laying in a wallets whis lost or forgotten :)

Update: Opened it. Alas, I am not a filthy rich :) But... If I am not mistaken, I'm about 150 bucks richer. Bonus! :)",CryptoCurrency,Found my old wallet.dat circa 2012 year on my flash
1614325787,https://www.reddit.com/r/CryptoCurrency/comments/lssskt/dont_leverage_trade_please/,505,425,"So.. I'm a bit embarrased to write this, but if it prevents a single person from not losing money, it's worth it. Here goes.

I'm a student who had a bit of spare money which just kept sitting and depreciating on my savings account. I don't really need that money and it isn't anything lifechanging (I couldn't even buy a car with it), so I decided to go all-in in crypto. I picked DOT for sensible risk-reward ratio. Things have been going great, when DOT peaked I doubled my money. I wanted to sell something to buy a new laptop at that point but my DOT was locked in staking and, more impornantly, I had a huge exam coming.

When things were crashing for a few days I finally decided to unstake a third of my holdings - unstaking period on Binance is 2 days, my 60 DOTs arrived yesterday. After I passed (hooray!) the exam, I was really exctasic, and so was crypto, for that matter. I was convinced BTC was now safely above 50K USD. I hade prior experience with leverage trading, It always went like this: **made money -&gt; got greedy -&gt; increased leverage -&gt; lost everything.** Total amount lost is like 150 USD - so nothing terrible - but my potential profits (if a pulled the trigger) were in 1-2K USD area. That sucked but at least it wasn't my money.

I didn't really like the idea of selling my DOT as I truly believe in it's future - but i found something called futures. Didn't realy understand it but aparantelly there is also a possibility to leverage trade with your tokens (instead of USD) as collateral. That sounded great, were finally recovering from the crash to 45K USD, why not make a bit of extra money?

I started with 3x leverage, nothing crazy and plenty of cushioning if shit hits the fan. In a few hours I made profit made a profit of 10 DOT or 340 USD - that's crazy, I'm from Europe and this is more than I made at my part time job for all of February! I was really pleased with myself, I passed the exam, my girlfriend came over and now this.

This all happened after 4 sleepless nights, I was really nervous about that exam and couldn't sleep. Finally, I decided to go in bed - and my stupid ass opened another leveraged trade, after all, BTC was now stable, right? I woke up 9 hours later, BTC meanwhile dropped from 51 do 47K and my long trade lost value from 70 DOTs to 30. I could have swalloved it and cut my losses but I didn't, of course.

In the next few hours I opened and closed many long/short trades with increesing leverage, just trying to save what lost. That didn't work. It never works - especially when greed and panic takes over. During the course of writing my post a lost last 12 DOT on overleveraged trade in the final attempt to break even. I didn't even care about it - despite 12 DOT being more than I make in a month.

I'm feeling like shit right now, called my girlfriend who is really awesome and managed to improve my mood a bit. Also I still have 2/3 of my DOT holdings, I'm not in a loss - but my P/L is really close to 0 now. Decided to withdraw the rest from staking and will concider selling some of it if the market rises again. That said, I can't imagine how this possible feels when you loose your family savings or even take a loan to trade crypto.

I guess the bottom line is this: **Don't be greedy**. It's not that hard to make more money out of it but you get in a never ending downvard spiral - always wanting more, more, more... Also, there are more important things in life than money - one of them is mental health. If you get severely depressed as a result of investing in crypto, it isn't worth it. I don't care what you say, it just isnt.

I'm sorry for a chaotic post but I really wanted to get it out of my self. Leverage trading is shit. Market will recover, your losses won't. Please, spread the FUD about leverage trading, I'm going to go for a walk now. Also, I'm sure there are far worse stories than mine - I'd be happy to hear them if you got over it and want to further encourage people not to do this.

Stay strong.

EDIT: I'm feeling a lot better now, thanks for all the comments!",CryptoCurrency,Don't leverage trade. Please.
1614324837,https://www.reddit.com/r/CryptoCurrency/comments/lsslks/for_those_who_werent_aware_coinmarketcalcom_is_a/,66,115,,CryptoCurrency,"For those who weren't aware, coinmarketcal.com is a great calendar tool that keeps you up to date with the latest cryptocurrency events and could help you make better decisions when trading"
1614321967,https://www.reddit.com/r/CryptoCurrency/comments/lsryk5/babel_fees_on_cardano/,346,335,,CryptoCurrency,Babel fees on Cardano
1614354307,https://www.reddit.com/r/CryptoCurrency/comments/lt0cpj/if_youre_investing_in_crypto_youre_not_spending/,67,61,"I'm sure that a lot of community, myself included, get into our heads over the fact that we're ""Too late to the party"" or ""haven't invested enough to make a noticeable difference"".....

Please get this mindset out of your head, and be proud about the fact that you are **INVESTING YOUR MONEY**. 

The common person gets paid, pays their bills, and with any luck - has some left over for some personal spending. This is all well and good, but also makes life difficult if you want to save and get ahead later on. 

Don't be upset if you only have a small amount of money invested in Crypto, or you assume that you're too late to the party. You're making smart future decisions, and you'll fucking thank yourself down the road, I guarantee it. 

Hold your head high, Champ!",CryptoCurrency,"If you're investing in Crypto, you're not spending money on useless goods, and you're taking care of your future self.... Be proud of that!"
1614354163,https://www.reddit.com/r/CryptoCurrency/comments/lt0aww/dont_tell_anyone_how_much_youve_made_off_of_cc_my/,905,800,"Holy hell the number of people and relatives that come out of nowhere was surprising. He only told a few people but it quickly spread. The real problem is not those irrelevant people, but his closest and direct relatives. Our family seemed stable when it came to money. No one ever seemed like they'd be like this other than 1 or 2 members. Some of his siblings are fighting him, his mum is just being a horrible person. The things that have been said left me in shock. My parents/siblings have been trying to resolve this but I also see the greed in some of their eyes.

&amp;#x200B;

I feel bad for the guy. We spent the first week just talking and doing random shit to distract him from the situation at home. Some of his relatives turned on his girlfriend blaming her when she has kept quiet the whole time and just supporting my cousin. Honestly, I'm worried for him. We don't know how to handle the future, but for now, we're just making sure he spends it wisely and limits himself.

&amp;#x200B;

Seriously guys, LPT even if you think your family is not like other families, and money won't cause this. Just stay quiet. It's for the best. I've always felt this way, but after seeing it... just wow

&amp;#x200B;

&amp;#x200B;

I hope everything makes sense up there cuz I have yet to sleep and I feel like I'm rambling",CryptoCurrency,Don't tell anyone how much you've made off of CC. My cousin recently sold everything since he has enough to retire and...
1614353172,https://www.reddit.com/r/CryptoCurrency/comments/lszy06/cardano_overtakes_binance_coin_as_the_3rd_largest/,1616,1648,"I'd say it's about time we saw Binance Coin drop down a notch! Considering the amount of work put into building the foundations of a 'future proof' cryptocurrency, the Cardano project is finally starting to take off, and now we see it taking its rightful place on the rankings.

https://preview.redd.it/no9ryaniauj61.png?width=736&amp;format=png&amp;auto=webp&amp;s=000fab0f0f01baadc00d6ed600f4cb3ea1b94345",CryptoCurrency,Cardano Overtakes Binance Coin as the 3rd Largest Cryptocurrency by Market Cap
1614353014,https://www.reddit.com/r/CryptoCurrency/comments/lszw22/crypto_helped_me_curb_my_shopping_addiction/,120,53,"I used to buy stuff online all the time, just because i know i have extra money and i didnt know what to do with it.

Enter crypto. 

Now everytime i want to buy something i gotta think: “How many *insert coin here* can i buy with this money im about to spend?” After that i go and look at prices, and i immediately dont think about the stuff i thought i wanted.

At least now i can safely say that i am doing some kind of “investment” (if i can call it that) for my future.

So i guess what I’m trying to say is.. thanks crypto &amp; r/cryptocurrency.. for saving me from myself and giving me hope for the future.",CryptoCurrency,Crypto helped me curb my shopping addiction
1614800629,https://www.reddit.com/r/CryptoCurrency/comments/lx2jq9/the_first_bitcoin_reference_in_television_history/,181,312,,CryptoCurrency,"The first Bitcoin reference in television history aired on The Good Wife in 2012, when it was only worth $3.41"
1614800271,https://www.reddit.com/r/CryptoCurrency/comments/lx2ewr/if_you_can_only_afford_to_invest_a_few_dollars_in/,419,648,"I've seen some pretty nasty comments towards small time investors in some or the discord channels I follow recently.

Crypro isn't just for the rich, everyone is welcome here and by buying bitcoin and other cryptos you are investing in the future.

If someone had invested just 1 dollar a month back at the start they would be minted right now.

Ignore the haters and if you want to buy in, do just that. Just remember to only invest what you can afford to lose!",CryptoCurrency,If you can only afford to invest a few dollars in crypto but still want to then do it! Not everyone can afford thousands but you are still welcome in this space.
