created_utc,full_link,num_comments,score,selftext,subreddit,title
1612261964,https://www.reddit.com/r/CryptoCurrency/comments/lasqsx/this_will_be_a_huge_week_for_bitcoin_and_crypto/,195,114,"So first of all, for those unaware, tomorrow there is a presentation by Saylor from MicroStrategies where a lot of high end CEO’s will learn about crypto and the investment opportunities that are out there. Even if only a handful of these CEOs take this opportunity to invest in Bitcoin, it will be a huge boost for its succes. 


On top of this, a big batch of Grayscale funds become available the coming week, which always has a high correlation with Bitcoin mooning. These two events combined are like the perfect storm, with a lot of media attention on crypto as well, and a lot of money flowing in from casual investors redistributing their GME profits. 


If Bitcoin doesn’t hit 40k within 5 days (7 FEB 23:59) I will give away my moons to the top comment on this thread, I am VERY confident that Bitcoin will surpass 40k with ease and might even have a run at 50k before February is over. And as we all know, after Bitcoin moons and (hopefully) stabilizes at 50k, its altseason again baby.


SOURCE FOR GREYSCALE: 

https://hackernoon.com/grayscales-gbtc-pump-effect-means-2021-will-start-slow-0gu340l

Read this article, it is very interesting and has so far been very accurate. They predicted the BTC slump since ATH and expect it to pick back up pace around Feb 3rd since Greyscale unlocks their 9th tranche of funds, meaning Grayscale will do mass acquisition around Feb 3rd causing the price to go up significantly.


EDIT: BTC was 34,300 at the time of writing this!",CryptoCurrency,"This will be a HUGE week for Bitcoin, and crypto as a whole."
1612259131,https://www.reddit.com/r/CryptoCurrency/comments/las3zg/omg_i_found_out_i_was_sitting_on_8k_worth_of_uni/,249,215,"So I’ll try to make a long story short but back in the summer time, I was turned on to the DEX hype and all the defi jazz. Played around on Uniswap and didn’t really make much and spent more on gas prices than I made profit. Things got rough financially and I had to pull everything. Soon after, the market took off without me. And I watched as everybody enjoyed their gains. I kept an eye on crypto for the most part but I never had any extra funds to contribute. 

Well, last night I was watching ChicoCrypto and he mentioned an app called Zerion which is basically a one stop shop for to track your defi portfolio. I connected my wallet and then to my surprise, it said I had $7900?? 400 UNI unclaimed. I thought it was too good to be true but I logged into UniSwap and sure enough, 400 tokens I never claimed. 

I know if I’d known this before I wouldn’t have had the balls to Hodl but blessing come in many different ways. 

So if you used UniSwap prior to September 2020 and had no idea about the airdrop then go link the wallet you used and claim your 8k!!",CryptoCurrency,OMG! I found out I was sitting on 8K worth of UNI!!
1612265770,https://www.reddit.com/r/CryptoCurrency/comments/latmv1/losing_money_on_cryptocurrency_is_a_rite_of/,81,86,"I see we have a lot of new members who got duped by the Dogecoin pump and dump. I'm very sorry to see this happen, but props to you all for sticking around. trust me.. it will be worth it.

I made my first bitcoin purchase about 3 years ago. February 2018. I think bitcoin was right around 12,000. If you dont know, it continued to decline for the next year, down to about 3k. I lost 75% of that initial investment, but I continued buying on the way down, and on the way back up. I'll never stop buying bitcoin. 

WSB, MOON and HOLD: I'm not trying to take props for anything, but I think the cryptocurrency community coined these terms. We are the original diamond fists. I HODL (hold on for dear life) my coin, and I still own the very first lil chunk of bitcoin I've ever bought.

I hope you guys are experiencing what I felt when I found crypto in 2018, and if you have any questions feel free to ask. My PMs are open",CryptoCurrency,Losing money on cryptocurrency is a rite of passage
1612248378,https://www.reddit.com/r/CryptoCurrency/comments/lapne2/stellar_xlm_notes/,353,318," I have been a lurker for a long time here but I would like to contribute more to the community and in order to do so I will share a little of my research on different coins. Stating with XLM, one of my favorites cryptocurrencies, I apologize for my english as it is not my first language. Most of this information is from their official website. I personally support this project because I know the burdens and fees of having to send money outside of the US and I appreciate what Stellar Development Foundation is working on. 

XLM - Current Price $0.3209

   

|Website|https://www.stellar.org|
|:-|:-|
|Course and more info|https://www.lumenauts.com/courses/stellar-overview-course|
|Buy direct from network|https://lobstr.co/|
|Rank on CoinMarketCap|11|
|Rank on Coinbase|4|
|Market Cap|50 Billions Lumens|
|Open Market|20 Billions Lumens|
|Price Change %|Up 140% 1M, 403.59% 1Y, 10,739% Alltime|

Created in 2014 after bitcoin but before Ethereum, launched in 2015 by the Stellar Development Foundation, a non-profit company based in the U.S. It is designed so all the world’s financial systems can work together on a single network. Intended to enhance rather than undermine or replace the existing financial system. 

Stellar enables a future where everyday people can send money anywhere affordably and quickly. Like any payments system, Stellar allows one user to send currency to another. User A can send User B dollar tokens or lumens or whatever. But Stellar also allows a user to send one currency and have the recipient receive another. Essentially, you can send and exchange money in a single atomic transaction. 

Each year, over $500 billion of value is transferred cross-border through personal remittances. In most cases, remittances are transfers of money from foreign workers to family members in their home country, sent on a monthly basis. The typical transaction is $200 to $300 and the average retail cost of these transfers runs 7-8%, usually collected in cash. Sending costs can be as high as 15% when transferring money to people in developing economies. 

Unlike the tokens of other blockchains, lumens aren’t mined or awarded by the protocol over time. Instead, 100 billion lumens were created when the Stellar network went live, and for the first 5 or so years of Stellar’s existence, the supply of lumens also increased by 1% annually, by design. That inflation mechanism was ended by community vote in October 2019. And in November 2019, the overall lumen supply was reduced. Now there are about 50 billion lumens, total, in existence, and no more lumens will be created. Nearly 20 billion lumens are out in the open market, and the Stellar Development Foundation retains the other 30 billion or so to develop and promote Stellar, per its mandate. Those lumens will enter the public markets over the next few years.

Please feel free to share your thoughts on XLM and if you think XLM is a good crypto to hold.
Edit: XLM Price was wrong by a decimal now corrected",CryptoCurrency,Stellar XLM Notes
1612243901,https://www.reddit.com/r/CryptoCurrency/comments/laohpf/michael_saylor_says_he_has_never_seen_so_many/,168,421,,CryptoCurrency,Michael Saylor says he has never seen so many CEOs sign up for one of Microstrategy's events.
1612197716,https://www.reddit.com/r/CryptoCurrency/comments/la7i3u/why_im_so_enthusiastic_about_nano_and_why_you/,492,252,"This is a longread, so **tl;dr** \- Nano's UX and fundamentals are incredible (try it out yourself), has a large (developer) community around it, and also has a lot of price upside.

So it seems that despite having commented about Nano fairly often on this subreddit I've never laid out just why I'm so enthusiastic about Nano. So in this post - my reason for being so enthusiastic about Nano, how you can try Nano out within 2 minutes, and what the future for Nano might be like.

# Why am I so enthusiastic about Nano?

I got into crypto because I believe in having a decentralised digital currency. I believe that a future in which all people have direct access to an undebaseable, self-sovereign currency is a far better future than a future in which we are bound to using fiat currencies to pay.

I believe Nano is the currency that stands the best chance at being this decentralised digital currency. I'm in agreement with Elon Musk that when it comes to currencies, ""[whichever has least error &amp; latency will win](https://twitter.com/elonmusk/status/1349977642708168704)"". There needs to be as little friction as possible in currencies as possible - in terms of latency, throughput, and fees. How does Nano fit in here? Well, Nano's fundamentals are as follows:

* [Lowest latency cryptocurrency](https://nanocrawler.cc/network) (0.15 seconds to fully confirm, on average)
* Zero fees - no leeching middlemen ([I explain how no fees means no centralisation yet gives plenty incentives here](https://np.reddit.com/r/CryptoCurrency/comments/la7i3u/why_im_so_enthusiastic_about_nano_and_why_you/glpeyfv/))
* Incredibly secure - deterministic finality versus the probabilistic finality of traditional cryptocurrencies
* Has never had a double spend, re-organisation, or inflation bug
* Had a [third party security audit](https://medium.com/nanocurrency/nano-protocol-security-audit-summary-and-full-report-48760be8ab3d)
* No inflation - fully distributed
* Incredibly energy efficient/green - the entire network can run on roughly one windmill
* High throughput ([200 CPS+ in latest stresstests](https://forum.nano.org/t/nano-stress-tests-measuring-bps-cps-tps-in-the-real-world/436)), still improving passively by scaling through hardware and actively through development.
* Usable as an method of exchange (i.e. directly spendable) - that  means that early whales won't all have to ""cash out"" to take profits,  they really could use it for goods/services directly

I understand that these are lofty claims, and that they sound unbelievable. However, all of these can be verified either through the [Nano protocol/website](https://docs.nano.org/what-is-nano/overview/) or through links I've added. A more practical approach would be to verify the low latency, feelessness and great user experience for yourself by taking two minutes to try it out.

# How to try out Nano

1. Install Natrium ([Android here](https://play.google.com/store/apps/details?id=co.banano.natriumwallet), [iOS here](https://itunes.apple.com/us/app/natrium/id1451425707?ls=1&amp;mt=8)).
2. Visit a [Nano Faucet](https://nano-faucet.org/).
3. Fill in your Nano\_ address and hit send.

That's all! To really try it out I'd recommend getting a second wallet such as [Nault (web-based)](https://nault.cc/) or Nalli ([Android here](https://play.google.com/store/apps/details?id=fi.heimo.nalli),[ iOS here](https://apps.apple.com/app/id1515601975)),  then sending some Nano from your first wallet to the second.

I think trying it out is the single best way to experience the user experience/speed that we Nano enthusiasts are always raving about. I also believe that, given that it takes just two minutes, it's worth taking some time out of your day to verify or disprove these claims that are so often made. I've tried my fair share of cryptos and wallets, and I can tell you I have never seen a crypto-related user experience that can compete with using Natrium to send and receive NANO.

If I'm right, then Nano might be an incredible opportunity. If I'm wrong, then you can discount these Nano claims from now on and save yourself a lot of time.

**Wait, people are giving Nano away for free?**

Yes, many people are just **that** enthusiastic about Nano. I think that practically everyone here on r/cc can attest to the fact that Nano enthusiasts are a very big group, and a very active group.

[I couldn't resist adding this in here.](https://preview.redd.it/dg3787bvaue61.png?width=700&amp;format=png&amp;auto=webp&amp;s=ab31fa3c87993bd114f9915543a7faca8dd64e58)

It's not just r/cc though. A different crypto subreddit recently (literally) had their entire hot page filled with Nano posts, r/nanocurrency is an incredibly active subreddit, and even on other subreddits around Reddit you'll often run into Nano posts and comments. The same holds true for Twitter - Nano is consistently in the top 3 most talked about cryptocurrencies on Twitter.

Luckily though, it's not just a bunch of shills and enthusiasts. Nano also has a very large developer community around it building awesome stuff on Nano. The Natrium wallet was named before, but there's also a [great web/desktop wallet in Nault](https://nault.cc/), the awesome [Nalli wallet](https://nalli.app/) that allows you to send Nano to anyone using their phone number, and even recently got [the first cryptocurrency wallet for KaiOS](https://kaiak.cc/), the second largest mobile OS in India and many developing countries.

On top of that, there are Nano TipBots for practically every platform, such as for [Reddit](https://github.com/danhitchcock/nano_tipper_z)/[Twitter/Telegram](https://nanotipbot.com/)/[Whatsapp](https://thenanobot.com/), and there is so much development happening that it's [just too much to list in this post](https://np.reddit.com/r/nanocurrency/comments/kkgq8h/looking_back_on_a_year_of_nano_development/). One more thing I'd like to point out is [WeNano](https://wenano.net/), a newer app that functions as a wallet and allows users to create hotspots that grant free Nano to others based on their location. It's like Pokemon Go, but then for crypto. WeNano has already exploded in use worldwide, especially in 3rd world countries where these undebaseable, self-sovereign currencies are needed most.

**This all sounds pretty fantastic so.. why has the price been declining?**

To be fair, the price has roughly quadrupled since a month ago. But it's true, Nano had a huge run-up in 2017 peaking at $30+ shortly. The bull market ended shortly thereafter, and Nano had a massive decline of nearly 99% over the next couple of years, not exactly helped by one of the two exchanges on which Nano was traded having a double withdraw bug + an exit-scamming exchange owner.

Things have begun to change. NANO bottomed out with the rest of the crypto space, went through a healthy accumulation phase, and has since begun showing signs of life yet again. It's been going up a fair bit lately, and more importantly Nano is experiencing a massive increase in interest. It's actually the reason I've been less active in r/cc \- I literally cannot keep up with all the DMs, Discord messages, chats and questions elsewhere I get about Nano. This is no hard data, but I'm pretty sure I alone have sent to over 300 newly opened wallets this past weekend because people wanted to try Nano out, and the faucets are seeing a surge in use as well.

**So what is the price upside here?**

I think I've described well enough why this is exciting from the perspective of someone interested in the tech and wanting to have a global decentralised digital currency, but what is the price potential here? To be honest, I am loath to do price forecasts, so here are some reasons I think Nano will go up, strongly, in the near future, without having an idea as to how much this will be.

**Exchanges.** Nano recently got listed on some exchanges (BitcoinSuisse for institutional investors, AnchorUSD for a direct USD gateway + exchanges in Turkey, Brazil, Indonesia) but *still* isn't listed on **Coinbase**. The Nano team recently applied for the Coinbase listing and Coinbase just so happens to have removed pruning as a prerequisite from their website. This could be a coincidence, but it's positive either way. Additionally, in another showing of Nano's big community, the post requesting Nano be added to Coinbase is now the [all-time most upvoted post](https://np.reddit.com/r/CoinBase/comments/l8lcwl/is_nano_cryptocurrency_planned_to_be_added_on/) on r/coinbase. Plus, Garry Tan, one of the early investors is [presumably still invested in Nano](https://twitter.com/garrytan/status/1231029507638693889). Another exchange that could list Nano is **Gemini,** and the good news here is that the twins have recently gotten more interested in Nano in the sense that they're liking Nano posts on Twitter. Thin proof, but it's something!

The most hopium part of all is of course Elon Musk. His [least error &amp; latency](https://twitter.com/elonmusk/status/1349977642708168704) post combined with him looking into crypto makes me hope that he'll run across Nano and try it out. The Nano community has recently developed a knack for getting their posts in front of people they want to know about Nano ([see also Raoul Pal](https://twitter.com/RaoulGMI/status/1353531308748767234)), and it's my hope this also gets the ultimate first principles engineer to give Nano a look [through this tweetstorm.](https://twitter.com/mira_hurley/status/1356277209212858371)

In essence, my thinking here - Nano has extremely good fundamentals, a large and enthusiastic (developer) community, a lot of price upside, hence is worth a look for anyone regardless of what got you into cryptocurrency.

I'd love to hear what people here think, and if anyone has any questions about Nano I'd love to answer them.",CryptoCurrency,Why I'm so enthusiastic about Nano - and why you should be too
1612196845,https://www.reddit.com/r/CryptoCurrency/comments/la7535/there_is_no_easy_way_to_get_rich_quickly_focus_on/,74,102,"With markets being overrun with opportunistic newbs, keep in mind that there is no easy way to get rich. 

Bitcoin was an unique concept from the start, GME has unique market circumstances that wil not be repeated soon. 

I have missed out on earnings as well, but chasing the 'next big thing' never ends well. I've lost a lot of money in 2018 by 'gambling' on altcoins and ICOs hoping to discover the next Bitcoin or GME. 

It doesn't work. If it was this obvious, everyone would do it. The next X1000 will most likely be something different entirely all over again. 

If you want to get rich, stop gambling your money away and put your money in relative ""safe"" investments like Bitcoin, Ethereum or ETFs. 

Gamble with a small amount for fun, but focus on longer term wealth creation with proven investments rather than trying to outsmart the market. Most people can't and you will regret it. Keep this basic wisdom in mind ""if something looks to good to be true, it probably is""",CryptoCurrency,There is no easy way to get rich quickly. Focus on long-term goals.
1612191999,https://www.reddit.com/r/CryptoCurrency/comments/la54bq/attention_newcomers_do_not_become_discouraged_by/,72,99,"A lot of us crypto veterans are no strangers to losing money. In fact, it’s a common thing a lot of us had to go through in order to learn some basic lessons in this space. I was stupid (still am, just less now) when I first got into crypto and fell for a few pump and dump schemes and scam projects. If there is one lesson I could deem the most important, it’s that you should NEVER invest more than you can afford to lose – no matter how strong the FOMO may be. I learned this the hard way when I threw a ton of money into crypto at the top of the 2017 bull run, resulting in barely living paycheck to paycheck and drowning in debt for a while.


Take the time to learn about the fundamentals of crypto and what it’s looking to achieve. I’m not going to shill my portfolio, but there are currently a lot of exciting projects in this space with a purpose other than being a meme coin. Are you inspired by the events of last week where the little guys banded together to stick it to the big players of Wall Street by beating them at their own game? Are you angry at Robinhood for halting trading and deciding to restrict us to what we can purchase while billionaires are free to do whatever and whenever they want? Then take a look at DeFi (Decentralized Finance) coins.


Finally, please for the love of God do not buy crypto on Robinhood. You can’t withdrawal from it, which goes against one of the most basic rules of crypto: Not your keys, not your coins.",CryptoCurrency,Attention newcomers: Do not become discouraged by crypto if your first experience was losing money on DOGE.
1612177058,https://www.reddit.com/r/CryptoCurrency/comments/la0lq2/maybe_controversial_a_coin_price_does_not_matter/,70,78,"Not sure if controversial or not, but I feel that it needs to be said in the current environment: a coin's price is its least interesting property. The crazy obsession about prices over anything else makes it impossible to have any discussion that goes further than 'we will so rich so soon!', 'it will go to the moon right away!', 'PUMP n HODL', and all the usual memes that people repeat continuously by pure mimetics, and that's really bad for the crypto currency community as a whole.

While market economics are an important part of blockchains there is way more to it than the current price of a coin. Look beyond the current prices, pumps, and ridiculous predictions from self-titled experts, and try to understand the underlying concepts, otherwise you're really missing on the most important parts of the crypto currency revolution.",CryptoCurrency,"Maybe controversial: A coin price does not matter. Do your research, learn the fundamentals, stop obsessing over getting rich scams."
