created_utc,full_link,num_comments,score,selftext,subreddit,title
1614373293,https://www.reddit.com/r/CryptoCurrency/comments/lt7qi5/am_i_the_only_one_worried_about_polkadot/,89,52,"I might get downvoted for calling out Polkadot, but I'm honestly interested and worried at the same time.

• Pretty new ( Genesis Block on May 2020) and managed to get/stay in top 10

• Kind of low developer adoption

• High fees to run nodes to validate network

• Large amounts of assets held by relatively few wallets  


I know that Polkadot was founded by Gavin Wood (a co-founder of Ethereum) alongside co-founders Peter Czaban and Robert Habermeier in 2016. Did it gain popularity because of those names?Has anyone used Polkadot other than for trading?

I know I haven't listed all the great things it can do, I just want to figure out it won't be the next BCC and have an honest discussion without bias (if possible).",CryptoCurrency,Am I the only one worried about Polkadot?
1614372895,https://www.reddit.com/r/CryptoCurrency/comments/lt7l69/wanted_to_clear_up_some_misinformation_going/,228,261,"I’ve been lurking around the sub a good amount today and everybody seems to be convinced Ada is some magical coin that will change the world and rocket to the moon. I am here to clarify some things about Ada.

Ada is actually a small town in Ohio where Ohio Northern University is located, home of the Polar Bears. They’re most well known for studying engineering and pharmacy. It’s a small private university where a year probably costs close to 50k per year so be prepared to sell an arm, a leg, and your soul to attend there if you don’t have a good scholarship or a trust fund.

Nearest major down is Lima. If you haven’t heard of Lima, you’re probably not familiar with Ohio. If you haven’t heard of Ohio, you probably aren’t from the states. Ohio is in the Midwest region. When I say Midwest I actually mean the mid-east when looking at the country as a whole on the map, but we call it the Midwest because geography is stupid. 

If you have any additional questions or confusion about what Ada is, please ask away in the comments and I’ll do my best to answer them.",CryptoCurrency,Wanted to clear up some misinformation going around about Ada
1614371477,https://www.reddit.com/r/CryptoCurrency/comments/lt72vv/i_compared_the_top_100_coins_by_market_cap_and/,188,114,[removed],CryptoCurrency,I compared the top 100 coins by market cap and their corresponding subreddit comments per day
1614371318,https://www.reddit.com/r/CryptoCurrency/comments/lt70px/stellar_lumensxlm_not_a_stablecoin_just_an/,408,498,"

Some people here think the world owes them guaranteed profits. You have invested in a project you believe will reward you with something bigger in return, yet you lose your cool every time you see red or it has been a *“stablecoin”* lately. I think this bunch of people either bought when lumens was at .40-60.

I believe that the people who have the largest holdings don’t even moan about this price. They have a strategy instead. They don’t constantly check the price and complain about how XLM is dipping or not pumping up hard lately. They are probably buying this dip more, or they have cashed out their initial investments and let the profits ride. They are probably more interested in learning what Stellar does to check if its mission is still being actively developed and upheld by SDF, so they’ll have the assurance albeit **not guaranteed** that they have put their money in the right project. They are probably the most patient ones cause they are secured by the fact that Stellar has gained more adoptions, and it has been around since 2014. It has survived the harsh crypto winter by developing more projects.

Cryptos have definitely caused a lot of “investors” (might as well say speculators) to have short-term memories and expect numbers to go up instantly. When they don’t, they think the coin is a shitcoin and jump into another one.

It is funny how we even call it cryptocurrencies when people don’t treat them as currencies but assets.

I get that it is highly frustrating knowing how XLM still hasn’t reached its ATH while some coins did. What this just shows me is that the market is irrational.

Consider Doge, a memecoin but went parabolic; XRP with Ripple being sued for selling XRP for profit yet it is still soaring; CAKE and BAKE which rose to a high price because of the DeFi hype; ADA with no real projects built yet but future speculations; ETH with congested network and high gas fees; and BTC which has failed to become a digital P2P currency and is now branded as a store of value.

If we talk about fundamentals, Algorand (I don’t hold any) and Stellar are at the forefront. The Marshall Islands used Algorand to issue their national digital currency called SOV. LTO has also gained partnerships with UN and the Netherlands Government.

We can say as well that Ethereum is at the forefront(heck even Bitcoin as it has the institutional backing), but until now it hasn’t fixed its scalability issues and the high gas fees. Sure, Layer2 exists like Loopring but majority of people still use Layer1 and using Layer2 solutions is actually not user-friendly. If Cardano can indeed deliver, then I don’t think Ethereum will be the main player in the long run.

If you look at CoinMarketCap though, most of the projects in cryptocurrency space are either a knock-off of Ethereum or trying to be the next Ethereum.

You have Binance launching its own DEX and taking opportunity of the crazy yield farming hype. You also have ATOM launching its own interconnected blockchain which sounds really cool, and you earn some sweet stakes at 10% APY, but the question that always crosses my mind is this: *what important problems are they trying to solve, and have they really solved at least one thing?*

Because all I see when it comes to these projects are: GREED. GAINS. SHORT-TERM. *HYPE.*

You can even earn 30% APY on some. How sustainable is this?

**It’s clear. The market is irrational.**

When all this hype goes down, I hope projects tackling important problems like Stellar will rise up, and maybe just maybe, XLM will be valued fairly.

**We know that XLM is undervalued.** We know that many traders use it as their bridge currency for exchanging their cryptos or moving coins between exchanges. We and they know that XLM has a great potential.
Just a day ago, a leading mobile operator in Turkey, Paycell, announced support for buying and selling of cryptos and guess what? [XLM is supported again next to ETH and BTC.](https://www.coinkolik.com/turkcellin-paycell-uygulamasi-ile-artik-kripto-para-alim-satimi-yapilabilecek/)

*[Ever heard of the gas station in Croatia accepting XLM, BTC, and ETH too?](https://finance.yahoo.com/news/croatia-tifon-gas-stations-hope-161428643.html)

*[Buying rums in Bermuda with a digital dollar issued on Stellar](https://www.coindesk.com/bermuda-to-pilot-digital-dollar-for-rum-sales)

*[Getting cashback rewards](https://paymynt.money/#blockchain)*

*Have you also heard that you can send absolutely send remittances now to Mexico, Brazil, Argentina, Tanzania, South Africa, and Nigeria using Stellar?* You can. Just use a Stellar wallet like Lobstr.

*What about creating NFT on Stellar without paying huge fees? You just need 2 XLM at most.*

*Do you even know that Stellar has an in-built DEX? Right. What does that mean? Well, if you download or use any Stellar Wallet, you can do P2P trades (buy, sell, or swap) for a fraction of a cent. In a simple word? You have instant access to a decentralized exchange. Stellar is a payment and a DEX platform at the same time.

The most famous Stellar tokens gaining traction? Well, Smartlands (SLT) with 7 million total supply tokenizing assets like real estate and agriculture and has a fee-pool incentive of 33% going to SLT holders holding €1000 of SLT as well as AKON which is being adopted in Africa.

As you can see, the tokens listed on Stellar are actually solving different purposes. They are not just a knock-off of Uniswap.

Listen. All major exchanges have stellar lumens (XLM) too. Another news? Coinbase will be launching their own debit card with 4% XLM cashback.

Lumens can be moved easily fast and cheap. It fits the most crypto of crypto as a currency.

Stellar is not all about hype and future speculations. They have the products working already. I believe if we value XLM based on fundamentals? It is easily a top 3 coin.

Its founder Jed McCaleb is also not a shiller. Some might say Stellar should up their marketing game, and they are working on that now. But I appreciate Jed for not being like the rest of the founders and devs who participate in Twitter shilling.

It’s clear. You can’t really call it a *failing crypto* or mock it as a *stablecoin.* I’ll wait till this underdog rises up. If I lose money, so be it. I have principles even in investing: I only invest in projects that solve important problems and do the work diligently without building so much hype than putting my money in projects fueled with hype but can’t offer anything tangible on the table.

To hotdogs and rums. *Only Lumenauts will probably get this.*

Edit: removed author by request.",CryptoCurrency,"Stellar Lumens(XLM): Not a Stablecoin, Just an Underdog"
1633534930,https://www.reddit.com/r/CryptoCurrency/comments/q2n2hn/i_am_being_a_very_good_boy_right_now/,441,193,I am sitting in my english class and my professor is taking with some students about what a great concept crypto is.  When I heard crypto I immediately started paying attention but when he said that I made sure to catch every word of their conversation.  Then someone mentioned they had a brother who bought ethereum last christmas and made tons of money.  From that point on it went downhill.  The girl next to him said she heard everyone should buy Shiba because it was doing good.  Then someone else brought up Elon and Doge and typing this out is my way of stopping myself from butting in and being annoying.,CryptoCurrency,I am being a very good boy right now
1633533912,https://www.reddit.com/r/CryptoCurrency/comments/q2mqrk/bank_of_america_13_of_us_will_use_crypto_before/,121,102,,CryptoCurrency,Bank of America: 1/3 of US will use crypto before 2022; Crypto will grow massively in the next 3 decades
1633532452,https://www.reddit.com/r/CryptoCurrency/comments/q2m8tx/the_panama_papers_and_pandora_papers_are_proof/,97,76,"The truth is that tax evasion via legal loopholes is well established both in the developing and in the fully developed world (looking at you Mr. Bezos). 

&amp;#x200B;

Cryptocurrency is absolutely not essential, nor used for this purpose, and the recent leaks over the past few years have proved, unequivocally, that tax evasion is NOT the primary function of cryptocurrency. 

&amp;#x200B;

I'm very bullish about this, because it hints at actual adoption, speculation, market viability, and true tokenomics outside of shady / grey-market goods. Even the most common purported coin - Monero - which might be used for illicit activities, represents a very small share of the total crypto market cap, and further demonstrates that the true value in crypto is not grey or black market, but truly above board investment, speculation, value storage, and adoption. 

&amp;#x200B;

If this isn't the best news we've gotten about crypto in a long time, I don't know what is.",CryptoCurrency,The Panama Papers and Pandora Papers are proof that crypto's primary use is *NOT* tax evasion.
1633496460,https://www.reddit.com/r/CryptoCurrency/comments/q2dir3/ethereum_is_coming_of_age_as_it_shows_that_a/,47,57,,CryptoCurrency,"Ethereum is coming of age as it shows that a staggering $6.2 trillion in transactions had been recorded in the past 12 months. In comparison with 2020, that represents a 369% increase in transaction volume."
1633495777,https://www.reddit.com/r/CryptoCurrency/comments/q2dcx0/edward_snowden_says_bitcoin_up_10x_since_he/,129,85,,CryptoCurrency,"Edward Snowden Says Bitcoin Up 10x Since He Tweeted About Buying It, China's Ban Makes BTC Stronger."
1633494722,https://www.reddit.com/r/CryptoCurrency/comments/q2d43v/confession_of_an_index_fund_investor_crypto_is_so/,122,76,"I have a confession to make - I thought crypto was irrelevant and so risky that it shouldn't touched with a 10 foot pole. I am in my late 30's and majority (90%+) of my investments are in index funds and have been ignorant about crypto until recently.

I started to educate myself and been reading about crypto in late August to gain rudimentary understanding. I then got serious about investing in crypto and started to buy BTC and Algorand in  September. Some in ADA and LINK thereafter. I still don't know shit about all the intricacies and all the tech involved, but the potential for returns is off the charts!  Oh, sending crypto is so quick and easy! None of this ACH BS waiting for funds to clear in 3 days (although I did had to wait when funding my exchange).

Official Algorand wallet - that sweet automatic staking and now governance is around the corner with even more rewards! So seamless and you just earn!

Crazy yield - 8% on GUSD, are you fucking kidding me? I thought I was lucky earning 0.55% in my bank savings account! 6%+ on BTC? Interest on appreciating asset? 9% on USDC? This is unheard of! (yes I know some exchanges provide higher rates but I avoid some due to how their businesses are structured).

I started to do even more search and signed up for additional exchanges and soft wallets to take advantage of their unique benefits.

Today I discovered about Lofty.ai. Holy shit, now I can buy real estate properties in less than 3 minutes and hold them as tokens in my Algo wallet. Crazy, this shit is insane!

So much potential in cryto for building wealth. So many unique products and new ways to do business, I am just in awe.",CryptoCurrency,Confession of an index fund investor - Crypto is so promising and the potential for creating wealth is insane
1633510952,https://www.reddit.com/r/CryptoCurrency/comments/q2glxa/this_is_the_worst_time_to_sell_your_alt_coins_for/,721,205,"As the title says this is actually the worst time for you to sell your alt coins for bitcoin. BTC has pumped almost 24% in the past week. Bitcoin dominance has jumped too, currently sitting at 42.62%. If we look at the past trends, when bitcoin makes a move, usually alts dump on their BTC pairs while maintaining the USD value or sometimes dumping on that pair too. Once Bitcoin is done moving, it stabilizes at a certain range and lets alts run. The first alt coin which usually moves is ETH and all the others follow it. So if you're thinking about selling your alts for BTC in hopes of catching a further 5% pump, think again. ALT/BTC pairs are currently bottoming and have way much more room to run.",CryptoCurrency,This is the worst time to sell your alt coins for bitcoin
1571730586,https://www.reddit.com/r/CryptoCurrency/comments/dlemwr/i_just_paid_an_88_transaction_fee_on_a_donation/,225,414,,CryptoCurrency,I just paid an 8.8% transaction fee on a donation to disadvantaged children. And look at how the fee is marketed!
1571727874,https://www.reddit.com/r/CryptoCurrency/comments/dle84j/opera_becomes_first_major_browser_to_enable/,152,1218,,CryptoCurrency,Opera becomes first major browser to enable direct Bitcoin payments!
1571720965,https://www.reddit.com/r/CryptoCurrency/comments/dld2qg/binance_us_adds_iota/,17,71,,CryptoCurrency,Binance US adds IOTA
1623669530,https://www.reddit.com/r/CryptoCurrency/comments/nzkidz/personal_story_about_a_metamask_scam_going_around/,196,84,"*Good morning, everyone.*

This is a personal story that really hurts, and hits home, hard.

I hope to bring awareness and attention to all the scams and scammers in the ecosystem. I am tired of people being conned and overall, just over all the bad actors/players in the space. Again, I hope my story helps people pay attention and just double check everything and anything, anytime you send a transaction or load up your wallet.

I was an early investor into the company called Telcoin. I had been one of the first people to really dig into what they were doing, and I started sharing all that information to everyone that was willing to listen. One of those people that decided to listen to me was my father. I would like to give a little back story about why this hurts me, so please bear with me.

I grew up in a broken family at a very young age and I would move back and forth between my parents. As I grew older, I decided to live with my mother because all of my family lived in the immediate area, (even my dad’s side). So, me and my father never really had that chance to bond, as a normal father and son would. It wasn’t until I left for the military and grew up a little bit, before my father and I started to really have a best friend bond.

Now that I have given a little back story, you can see why this is emotional and again, one of those people that believed in the research that I did, was my father. Back in October he finally took the plunge and invested $2,000 USD into Telcoin. He was able to amass about 5.5 Million Telcoin at that time. The price started to climb higher and with that, we would talk to each other every day. Whether it be about the price, news, speculation or even announcements from the team.

We started to bond more on something that I was truly passionate about and dedicated a good portion of my time to. We were sharing information back and forth and were trying to find ways to help the ecosystem grow.

The time finally came for me to make sure he was set up right and that he finally got access to his assets. So, I created a separate wallet and put the tokens in there for him. It wasn’t until his recent visit that I gave him the ownership to the wallet. I gave him his seed words and he was able to successfully load his wallet up on his mobile device. I had told him about Metamask and how it was a safe reputable wallet that offered many options to help hold or trade digital assets. However, you need to make sure to keep your *seed words / private keys* safe. Write them down and put them in a safe. He was very adamant about keeping them safe, so I had no worries. The very next day, my father ended up leaving and heading back up north.

A couple days had gone by and I get a message about his tokens not showing up in his wallet. Me being confused, I called him and asked what was going on. He said he had downloaded Metamask on a new computer he had bought from Best-buy the day prior. Long story short, it was a fake Metamask browser extension. Whenever he loaded it up, it functioned exactly like Metamask normally would. However, this one asked him for his seed words / private key, 2 times. Once he put those words in again, he received ETH directly to his wallet *(Because he only held Telcoin in the wallet)* and all of the 5.5 Million Telcoin was sent to another address and swapped on Uniswap.

*Here is all the information I could come up with –*

One that stole the Telcoin initially - [0x84e85bCf8abA8c6a1f59512F117DfAEfC0F4efBc](https://etherscan.io/address/0x84e85bcf8aba8c6a1f59512f117dfaefc0f4efbc)

Then they swapped it on Uniswap 2 times.

[https://etherscan.io/address/0x84e85bcf8aba8c6a1f59512f117dfaefc0f4efbc](https://etherscan.io/address/0x84e85bcf8aba8c6a1f59512f117dfaefc0f4efbc)

One was for 1,000,000 TEL, valued at $26,631.65 USD

It was swapped for WETH (Wrapped Ethereum)

This is the transaction detail link -

[https://etherscan.io/tx/0x4f50d24ffbee6d8e06981ab1d5cf70ea9f4152d052ce67322df81e2f0986fad9](https://etherscan.io/tx/0x4f50d24ffbee6d8e06981ab1d5cf70ea9f4152d052ce67322df81e2f0986fad9)

Second one was for 4,499,999.92 TEL, valued at $119,842.42 USD

It was swapped for WETH (Wrapped Ethereum)

This is the transaction detail link -

[https://etherscan.io/tx/0x233e596d21da2c74d375a333cfe57f837147249cd7b27eec33be50931ed8145b](https://etherscan.io/tx/0x233e596d21da2c74d375a333cfe57f837147249cd7b27eec33be50931ed8145b)

This is where a majority of the ETH is at, at the current moment (June 14,2021) -

[https://etherscan.io/address/0xb5176e09bcad76eb75a894488310fb39789729a8](https://etherscan.io/address/0xb5176e09bcad76eb75a894488310fb39789729a8)

\-----------------------------------------------------------------------------------------------------------------------------------------------------

I tell this story because the scammer didn’t just take $182,000.00\~ USD away from my father, they took away that bond we were building through something I loved and enjoyed. That is what hurts the most.

I hope you all never have to go through something like this. Please be aware that we are very young in digital assets / cryptocurrency and many new ways will be conceived to try and scam you.

Lesson, always be on your toes, double check that send address and most importantly, NEVER GIVE UP YOUR PRIVATE KEYS!

Thank you for all that took the time to read this!

\*TLDR:  Dad downloaded a fake wallet browser extension and put his private seed in it.\*",CryptoCurrency,Personal story about a METAMASK SCAM going around! Please be Careful!
1623668814,https://www.reddit.com/r/CryptoCurrency/comments/nzkbph/moons_took_my_kids_to_vacations_for_the_first/,731,1019,[removed],CryptoCurrency,MOONS took my kids to vacations for the first time in their lives!
1623684854,https://www.reddit.com/r/CryptoCurrency/comments/nzpinp/the_sec_has_no_plans_to_regulate_bitcoin_in_2021/,162,260,,CryptoCurrency,The SEC Has No Plans To Regulate Bitcoin in 2021
1623683492,https://www.reddit.com/r/CryptoCurrency/comments/nzozpu/daily_breakdown_june_14_2021/,155,230,"Bullish Breakdown:


- Bitcoin price broke above $40,000 again for first time in over two weeks. 


- Tanzanian President Samiah Suluhu Hassan has told the country's financial chiefs to prepare for crypto, declaring that the age of crypto and blockchain is dawning - “We have witnessed the emergence of a new journey through the internet.""


- Billionaire investor Paul Tudor Jones said that he likes bitcoin as a portfolio diversifier and wants to allocate 5% of his assets into the cryptocurrency.


- MicroStrategy has completed yet another offering of senior secure notes, raising $500 million to buy more bitcoin. Why this is bullish: MicroStrategy already owns $3.8 billion in bitcoin (more than any other corporation in the world).


- Not new news, but still worth mentioning: El Salvador’s president, Nayib Bukele, recently announced that El Salvador is establishing Bitcoin as legal tender and is opening its arms to cryptocurrency companies in the coming months. During a parliamentary meeting last week, the vote passed with a supermajority. 


- The Central American Bank for Economic Integration (CABEI), the largest multilateral development bank in Central America, will assist El Salvador in its endeavor to adopt Bitcoin, President Dante Mossi announced Monday. 


- Bitcoin has rebounded over the weekend on the back of a tweet from Elon Musk saying that electric carmaker Tesla would resume its use of the cryptocurrency once it had proved its green credentials. 


- Texas banks can now store crypto assets for clients, the state's banking regulator has announced. 

- Goldman Sachs plans to expand its client-facing crypto offerings with ether options and futures, according to a Monday report by Bloomberg.


Bearish Breakdown:

- The Dutch Bureau for Economic Analysis director has called for the Netherlands to ban Bitcoin immediately. 


- South Korea is increasing regulatory oversight on exchanges through mandatory KYC verification and other licensing requirements. 


- Thai regulators ban exchanges from trading meme tokens and NFTs.


- Crypto growing to a $1.6 trillion market without adequate regulations is a major worry for the head of Italy’s stock market oversight agency.


Let me know if you guys like this format and if I should make more posts like this in the future. Long live the bulls!",CryptoCurrency,"Daily Breakdown - June 14, 2021"
1623682921,https://www.reddit.com/r/CryptoCurrency/comments/nzos4o/bitcoin_soars_past_40000_following_paul_tudor/,314,304,,CryptoCurrency,"Bitcoin Soars Past $40,000 Following Paul Tudor Jones, Musk and Tanzania News"
1633466441,https://www.reddit.com/r/CryptoCurrency/comments/q253jd/elizabeth_warrens_new_bill_would_require/,79,54,,CryptoCurrency,Elizabeth Warren's new bill would require ransomware victims to disclose the type of crypto they used to pay hackers - Might as well call the Monero Bill
