created_utc,full_link,num_comments,score,selftext,subreddit,title
1605594911,https://www.reddit.com/r/CryptoCurrency/comments/jvo81d/former_eos_veteran_loses_faith_in_eos/,365,272,"I sold everything I had in EOS last week. And I'm not just some random moon kid. I worked for one of the founding BP's, made videos explaining how to register for the genesis block, was featured on EOSRad (before it was sold), and actually was paid in EOS by the BP. Essentially what I'm trying to say is I had DEEP involvement with EOS since about spring 2017, and I've lost all hope it will recover.

In my opinion, the first blow came when the arbitration governance failed. It failed because it was poorly thought out, but was needed to prevent BPs from vote buying. If there was an outside entity stronger than the BPs it could keep them in check. Unfortunately what happened was the BPs took power and then with nothing to check their power but votes, the exchanges voting with other peoples deposits used their votes to set up voting cartels that ousted even the best BPs who contributed such incredible value to EOS (EOSNY, EOSCANADA, EOSDAC, EOSCAFE, and more that I'm probably forgetting).

Once the BP voting cartels took over, they used the BP rewards as a money printing machine and created sell pressure. Not only that but all the airdrops seemed to create little to no value for either the holders or the projects and many of them died out. At this point, things were salvageable if Block.One came in with their 100m votes and voted back in good BPs and also fixed governance so vote buying couldn't happen. However, Block.One ignored the EOS mainnet problems, and the final nail began to drop, the slow, eroding of the community. Once community started to lose energy, excitement, and eventually hope, the slow death began and is still going on. I don't think EOS will go down in a blaze of flames, instead it'll be a token that slowly goes from a top 10 coin, down to a struggling top 20 coin, then to a depressed top 50 coin, and then into a ghost town top 200 coin. Some people will hold onto the dream but most will leave, just look at bitshares and steem if you want examples of what I believe EOS will become one day.

It's extremely depressing to have to face reality, but this is where things have been heading and where they still are.  Anyone holding EOS is just eroding their wealth hoping for a dream that will most likely never come. Snap out of your false hope, cut your losses and get out whatever you still can.",CryptoCurrency,Former EOS veteran loses faith in EOS.
1605575633,https://www.reddit.com/r/CryptoCurrency/comments/jvjkbn/we_bought_50_acres_to_build_a_solar_powered/,65,56,,CryptoCurrency,We Bought 50 ACRES to Build a SOLAR POWERED CRYPTO MINING FARM !!
1570367933,https://www.reddit.com/r/CryptoCurrency/comments/de34qj/liechtensteins_parliament_unanimously_approves/,44,459,,CryptoCurrency,Liechtenstein’s Parliament Unanimously Approves New Blockchain Act
1570357459,https://www.reddit.com/r/CryptoCurrency/comments/de1ioe/libra_paypal_first_to_drop_out_of_facebook/,23,183,,CryptoCurrency,Libra: PayPal first to drop out of Facebook cryptocurrency
1612108658,https://www.reddit.com/r/CryptoCurrency/comments/l9f1y7/take_a_breath_zoom_out_stop_trying_to_daytrade/,102,128,,CryptoCurrency,"Take a breath, zoom out, stop trying to daytrade. This is my portfolio graph from the last two years. I never lost money."
1612108375,https://www.reddit.com/r/CryptoCurrency/comments/l9eyk4/me_and_the_boys_after_shorting_dogecoin_for_a/,20,57,,CryptoCurrency,Me and the boys after shorting dogecoin for a quick $35 profit
1612107523,https://www.reddit.com/r/CryptoCurrency/comments/l9enyw/rcryptocurrency_reacting_to_the_inevitable_xrp/,227,213,,CryptoCurrency,r/Cryptocurrency reacting to the inevitable XRP dump
1612106756,https://www.reddit.com/r/CryptoCurrency/comments/l9eejz/crypto_reddit_is_on_another_level/,82,442,,CryptoCurrency,Crypto Reddit is on another level
1612106474,https://www.reddit.com/r/CryptoCurrency/comments/l9eb43/the_walking_doge/,142,428,,CryptoCurrency,The Walking Doge
1570319963,https://www.reddit.com/r/CryptoCurrency/comments/ddvksz/apple_ceo_tim_cook_slams_facebooks_libra/,159,1150,,CryptoCurrency,Apple CEO Tim Cook slams Facebook’s Libra cryptocurrency as a power grab
1611785767,https://www.reddit.com/r/CryptoCurrency/comments/l6fy08/everybody_says_buy_the_dip_but_cant_find_the_dip/,208,67,"I’m pretty new at this space looking for a coin or token that can make me rich with only U$ 100. I’ve answered a lot of quizzes at Coinbase and now I’m ready to build my future and buy my lambo.

But I am facing a huge problem. Almost everyday People is saying “Buy the dip”. I think that The Dip is the best coin on the market because all of you are recommending it. But I don’t find where can I buy it.

At least I am happy to not have The Low, because I’ve noticed that everybody is selling this. 

Can you help me?",CryptoCurrency,Everybody says “Buy the Dip” but can’t find “The Dip” coin at any Exchange. Help me.
1605534389,https://www.reddit.com/r/CryptoCurrency/comments/jv6zd5/what_are_some_altcoins_you_bought_in_2017_that/,1215,141,"As the market went down, I'm sure a lot of us have recognized that many coins in our portfolio are nothing but trash. However, there are still some active and exciting projects that were also part of the 2017 hype. As I didn't keep track of the developments of each coin, it would be interesting to hear what the community thinks about their Altcoins. What are you still holding, what do you still believe in and why?",CryptoCurrency,What are some Altcoins you bought in 2017 that you still believe in?
1612215757,https://www.reddit.com/r/CryptoCurrency/comments/laf1b4/elon_musk_says_dogecoin_tweets_are_jokes_he_is_a/,734,1671,,CryptoCurrency,"Elon Musk says dogecoin tweets are jokes, he is a supporter of bitcoin"
1612288670,https://www.reddit.com/r/CryptoCurrency/comments/lb1xa4/miami_residents_soon_to_receive_their_salaries_in/,90,112,,CryptoCurrency,Miami Residents Soon To Receive Their Salaries In Bitcoin
1612287207,https://www.reddit.com/r/CryptoCurrency/comments/lb1bv0/cryptocurrency_could_hit_value_until_date_says/,39,73,"Feel free to use this template if you want to make an immature price prediction, or if you just want to quote a ""crypto expert's"" forecast on any chosen cryptocurrencies' price. 

Honestly, this is getting ridiculous now. 

^(P.S. Do you guys think ETH can hit $150,000 in the next 40 minutes?)",CryptoCurrency,[Cryptocurrency] could hit [Value] until [Date] says [Somebody]
1612226586,https://www.reddit.com/r/CryptoCurrency/comments/laj38e/keep_an_eye_on_tezos_something_big_is_happening/,74,76,"It the most anticipated Tezos upgrade, called Edo and i think it will go live on Feb 12. This will bring anonymous smart contracts which will open the gates for those interested in privacy enabled dapps. Afaik anonymous smart contracts doesn't exist yet. Also Tezos Foundation will release $100 million for development this year. I believe it will suddenly take off since it has been a long time since it rallied, this might be the catalyst",CryptoCurrency,Keep an eye on Tezos something big is happening
1612272035,https://www.reddit.com/r/CryptoCurrency/comments/lavas6/6_billion_stablecoin_usdc_lands_on_the_stellar/,260,297,,CryptoCurrency,$6 Billion Stablecoin USDC Lands On The Stellar Blockchain!!!
1612256646,https://www.reddit.com/r/CryptoCurrency/comments/larjz1/this_bullrun_is_just_starting_hear_me_out/,116,88,"We all saw that bitcoin pump in 2020 with awe, but that was just some bunch of wallstreet wales dumping a tiny amount of their hedgefunds into btc. What we now see with the GME Stock and doge pump and dumps is the beginning of an awakening of the small guys. People realize that they have power over the big guys and they will start to throw money at altcoins, now that btc was pumped. Once the hedgefond managers realize that, they also will throw money at alts, letting them moon like crazy. 
The fed and pretty much every country on earth keeps printing fiat too, so crypto is a great hedge against inflation, furthermore strengthening our cause. This is just the start of a fantastic season. We are all very early and up for a great ride!",CryptoCurrency,"This Bullrun is just starting, hear me out."
1612254209,https://www.reddit.com/r/CryptoCurrency/comments/laqzt1/time_to_step_up_and_protect_this_community/,2791,6813,"Given the events of the past week with Doge and XRP pump and dumps it’s clear that we need to protect people within this community. Some have been in this space for a lot longer than others and there’s been plenty of examples of scams throughout the years and plenty people scammed with them. 

The Doge pump last week angered me and you could see people getting excited and the inevitable was going to happen. A lot of new people got sucked into the prospect of quick, easy money and calls for calm fell on deaf ears.

Then the same with XRP. I had friends calling me about it and asking advice and I told them exactly what I thought was going on, which transpired to be the case.  Lucky they took my advice and held off. 

There’s been a significant rise in new accounts shilling these days and it’s our responsibility to help ease new investors into the space. It’s frustrating watching the endless shill. Is there anything else that can be done to protect this space? Scamming people doesn’t bode well for the future of this society.",CryptoCurrency,Time to step up and protect this community.
1612253356,https://www.reddit.com/r/CryptoCurrency/comments/laqt7a/the_gas_fees_are_a_killer/,233,84,"The ETH network fees are just horrendous.  Makes me not want to use it anymore, but all the useful stuff is on ETH blockchain. What do you guys think has the best chance of addressing the high fees... ETH2, DOT, maybe community chains like NANO?  I know there are coins like ENOL and GASG that help you get back gas fees, but it would be nice to have a protocol with minimal fees.",CryptoCurrency,The gas fees are a killer
1612252058,https://www.reddit.com/r/CryptoCurrency/comments/laqimw/first_time_crypto_investor_my_brotherinlaws_balls/,190,280,"Guy makes sick money but normally a drinker and likes to gamble $100s $1000s at a time.  You name it, sports, racetrack. Anything for a thrill.  I'm pretty convinced that's what he does when he's not working. His life is just eat, shit, work, gamble, drink, pass out.  There's really no science to this guy's life.   He's my age but looks double , but when he wants something he goes balls to the wall. 

He always said crypto was stupid.   

Anyway this guy calls me out of nowhere, says ""IM COMING OVER, I want you to show me how I can buy doge"". 

Sure.   He comes by.  First thing this guy does is slap 2 grand in fresh 100s on the table next to me and tells me to buy doge for him.   

NO PATIENCE AT ALL.  Like I have a stash of PKs on a hard drive waiting for him. 

I'm thinking most my shit is in wallets and I'm not parting with my shit coins either. 

So going through the process of setting up his account, I was trying to explain to him coinbase, his account, transfers, binance. Before I could finish half of a sentence... He tells me. ""I don't have time for this, just buy it"".

I bought Btc for him but there was a problem with his card. Only limited $1000 so we tried bincance.   Finally evil to get him to deposit 2000 I had to transfer BTC over for doge.   He said, ""I want you to sell it in 8 hrs whatever the price is and I'll be over tomorrow to pick up the money""  

I said.. woo wait a minute...you need to wait for the cash to transfer back to your bank account.    

 He starts fuming and says, ""NAH I can't wait, And I don't want BTC don't buy me that , there saying doge will hit $1"".   I told him I need btc from coinbase and he didn't understand. Just kept saying"" btc isn't going anywhere ""

Anyway, I bought doge, sold in 8hrs when It was down 60%.  He calls me up afterwards all pissed and then tells me to keep whatever is in there that he wants nothing to do with crypto ever again.


I don't understand how people like him make loads of money.",CryptoCurrency,First Time Crypto Investor: My Brother-in-law's Balls to the Wall FOMO on doge the other day.
1612250628,https://www.reddit.com/r/CryptoCurrency/comments/laq6t2/took_a_big_l_on_doge_extremely_happy_it/,156,181,"Learned how Crypto works, set up an app to trade with, learned about pump and dumps (bruh)

So happy to finally get started. Still doing lots of research and learn more. Still trying to figure out how to set limits on Binance so I don’t lose too much when I take my eyes off the charts lol.

Tried to pick some that have long term and short term potential, wish me luck! 

[deleted picture of holding at advice of commenter]",CryptoCurrency,Took a big L on Doge - Extremely happy it introduced me to Crypto though!
1612187171,https://www.reddit.com/r/CryptoCurrency/comments/la3dru/well_thank_doge_and_robinhood_one_day/,210,284,"When Robinhood stopped letting people buy DOGE, people started flocking to binance and other legitimate exchanges. Many had no idea Crypto exchanges existed.

Now kraken, binance, bittrex, coinbase, etc have tons of new users who may catch the crypto bug and even learn about their tech.

It's okay for Doge to be the gateway into crypto.

I'm sure many of us tried garbage weed from a foily pipe before learning about glass and sour diesel.",CryptoCurrency,We'll thank DOGE and Robinhood one day.
1612187072,https://www.reddit.com/r/CryptoCurrency/comments/la3cln/can_we_get_a_moon_proposal_to_ban_all_talk_about/,225,324,"I don't know how to do it myself. Hopefully someone can because this is toxic to not only the sub, but the Crypto space as a whole.

New investors are getting scammed, and they will not be back and it will limit the mass adoption of crypto.",CryptoCurrency,Can we get a moon proposal to ban all talk about Pumping or manipulating prices?
1612183842,https://www.reddit.com/r/CryptoCurrency/comments/la2cis/why_all_the_hate_for_coinbase/,227,79,"Hear me out before downvoting.

I get the frustration of having slow downs or crashes during peak times, I get it. But for people new to buying crypto it really is the best option. You can earn free coins by learning the basics about crypto which is cool.

Yeah they don't have 500 coins to choose from but for the beginning or novice crypto buyer/trader that's a very good thing. They introduce you to staking and converting currencies etc.

I'm not saying that people should only use coinbase but for beginners it's a great platform. Telling new users it sucks and they should go somewhere they can buy using leverage, convert to 500 shitcoins etc does more harm than good imo.

I started with coinbase, moved to coinbase pro and will eventually try other exchanges as my crypto knowledge expands. But coinbase was my entryway and helped get me going to where I'm much more comfortable looking at other options should I choose to do so.

Not trying to shill for coinbase but just giving my opinion.",CryptoCurrency,Why all the hate for coinbase?
1632357263,https://www.reddit.com/r/CryptoCurrency/comments/ptjp49/a_long_dormant_10_year_old_bitcoin_wallet_holding/,626,100,,CryptoCurrency,A long dormant 10 year old Bitcoin wallet holding 0.003 BTC has just been re-activated.
1632354936,https://www.reddit.com/r/CryptoCurrency/comments/ptj0oy/elizabeth_warren_says_that_the_crypto_is_rife/,2227,818,,CryptoCurrency,Elizabeth Warren says that the Crypto is rife with scams as $80 million was stolen in a 6 month span. She fails to mention the $11.11 Billion US banks were fined for shady business &amp; the $12 Billion consumers lost to banks from overdraft fees in 2020!
1632354885,https://www.reddit.com/r/CryptoCurrency/comments/ptj04s/rcryptocurrency_x_rnft_lets_talk_about_nfts_live/,119,95,,CryptoCurrency,"💎 r/Cryptocurrency x r/NFT: Let's talk about NFTs live with experts from Rainbow, Mirror, and Showtime! 
"
1614076174,https://www.reddit.com/r/CryptoCurrency/comments/lqfaq3/one_type_of_dip_that_i_really_enjoy/,149,810,"I noticed a lot of talk about dips today.  I thought I'd share one that I find quite comforting.  

**Bacon Broccoli Dip**


Ingredients

6 slices Bacon - diced

½ large Yellow Onion - finely diced

2 ½ Ethereum - Locked up in staking some shitcoins

2 cloves Garlic - minced

¼ teaspoon Crushed Red Pepper Flakes or 1 fresh jalapeno

6 Cardano

3 cups Fresh Broccoli Florets - chopped 

8 oz. Cream Cheese - at room temperature

1 1/2 cups Colby Jack cheese - shredded (or whatever sort of melty cheese you like)

25000 Par Tokens

½ cup Parmesan cheese - grated, plus more for garnish

1 tablespoon Scallions - chopped, plus more for garnish

½ cup Sour Cream

2 TBS Heavy Cream, Half-and-Half or Whole Milk

½ cup Mayonnaise

1 ½ teaspoon Worcestershire

½ teaspoon Kosher salt - plus more to taste

¼ teaspoon Pepper - plus more to 

Cook the bacon until it is crispy.  Pour off all grease, minus 2 tablespoons

Add onions and aromatics.  Cook for a few minutes until translucent.

Grease an 8 inch baking dish (preferably ceramic) and preheat oven to 350.  

In a large bowl, combine the bacon mixture with everything else except a quarter cup of cheese.   Stir well and plop into the baking dish.  

Sprinkle the rest of the cheese on top and bake for 20-25 minutes until all nice and bubbly.  Pro-Tip: Toss it under the broiler at the end for a minute or two to brown it nicely

Open Blockfolio (or whatever portfolio tracker you are using) and commence to stress eat this mixture with cracker/bread/spoon",CryptoCurrency,One type of dip that I really enjoy
1614141858,https://www.reddit.com/r/CryptoCurrency/comments/lr3xsj/dont_rely_on_reddit_to_tell_you_what_to_do/,104,67,"Lots of people giving advice to hodl or to sell some of your crypto.  Truth is no one really knows what is best to do right now.  Everyone's got an opinion and a lot of people are posting on here to simply reassure themselves.

There is no golden rule about what to do during dips or peaks, just figure out what you want from crypto yourself.  Make your own goals and decisions and don't rely on reddit to tell you what to do, because everyone's situation is different, and none of us really know what we're doing.",CryptoCurrency,Don't rely on Reddit to tell you what to do
1614140790,https://www.reddit.com/r/CryptoCurrency/comments/lr3m9m/nigerian_crypto_shutout_wont_depress_new_defi_and/,23,78,,CryptoCurrency,Nigerian Crypto Shut-Out Won't Depress New DeFi And Digital Asset Banking
1614140538,https://www.reddit.com/r/CryptoCurrency/comments/lr3jbo/binance_has_stolen_cryptopunks_artworks_which/,510,292,"Cryptopunks are a series of rare NFTs created by Larvalabs on the Ethereum network, and due to the rare nature they are selling at a great premium to their initial cost. 

Now Binance has stolen not only the idea, but the whole set of original artworks created on Ethereum by Larvalabs and are selling these on BSC binance smart chain at a fraction of their cost. These are nothing more than FAKES. 

This has forced Larvalabs to issue a warning:

&gt; Warning: There is a project called ""Binance Punks"" that has taken the art from CryptoPunks and is selling it as a copy on another chain. This is in no way an authorized project.

I understand the need for low txn costs on BSC, but this is not about low transaction costs. This is straight up fraud and theft of intellectual property.

I can understand if the idea is stolen (which is still shady but with open source software and credits given its acceptable) but stealing artwork made by someone else and running this on your chain is a terrible practice.",CryptoCurrency,"Binance has stolen Cryptopunks artworks which were created on Ethereum, and are now selling these stolen copies on Binance chain. This is blatant theft of artwork."
1614112920,https://www.reddit.com/r/CryptoCurrency/comments/lqshky/if_the_price_is_dropping_wouldnt_it_be_smart_to/,325,325,"My brother called me today and wanted to talk to me about Crypto. He is not a technical person more the complete opposite (Hippie). He knew I am into technology and I was talking about Crypto myself.

So today he called me and told me that he'd most likely certain that he wants to invest himself. Not because he believes in the tech as he doesn't understand it, but mostly because he wants to say fuck you to the central banks and gevernments. 
I told him we all do. So I talked a bit to him and told him the risks and that's it not guaranteed to make him money. He understood everything and said he'll think about it a little bit. 

Then I told him the current situation and that everything is dropping right now, told him this could go on for longer maybe even years. Without me saying anything he said

 ""But when the price is dropping right now, wouldnt that be a perfect buying opportunity?""

And I never was prouder",CryptoCurrency,"""If the price is dropping, wouldn't it be smart to buy now?"""
1614112875,https://www.reddit.com/r/CryptoCurrency/comments/lqsgxv/on_sale_today_all_cryptos_25_30_off/,42,60,"That is the mindset you need today.  Do what the big winners did 4 or 5 years ago.  Stop looking at the results and rely on the methodology.

We don't know how long this dip will last or how deep the drop is.  So start slow additional purchases on the biggest drops.  Even as they slide be confident in those buys.  You are not losing.  Not if you see the big picture.

But we do know that cryptocurrency is not going away.  This is an investment.  The Walmart stock legacy was not built in a year.  Neither will your portfolio.",CryptoCurrency,ON SALE! Today all Cryptos 25% - 30% off.
1614110934,https://www.reddit.com/r/CryptoCurrency/comments/lqrpv4/federal_reserve_appoints_probitcoin_chief/,69,157,,CryptoCurrency,Federal Reserve Appoints Pro-Bitcoin Chief Innovation Officer
1614179803,https://www.reddit.com/r/CryptoCurrency/comments/lrf85c/i_tried_nano_so_you_dont_have_to/,192,60,[removed],CryptoCurrency,I tried Nano so you don't have to...
1614176638,https://www.reddit.com/r/CryptoCurrency/comments/lre1t3/blockstream_ceo_says_institutional_investors/,15,61,,CryptoCurrency,"Blockstream CEO Says Institutional Investors Buying the Dip After Square’s $170,000,000 Bitcoin Purchase"
1612341472,https://www.reddit.com/r/CryptoCurrency/comments/lbj8qh/just_paid_off_my_mortgage_20_years_early_and/,1066,4730,"Long time lurker here. I've been in crypto for the last 4 years. In 2017 I held all the way through the bull market and then sat and watched my portfolio shrink to nothing as I was convinced the bull run had not finished. 

Fortunately I was patient enough and endured the whole bear market and yesterday with the new ATH of ETH I was able to sell enough to pay off my mortgage and place an order for my dream sports car.

I havent spoke on here much but I have lurked in the shadows from the start. Your posts and memes have got me through the bad times and helped me keep hold of my portfolio. Thank you to you all and I hope you are all in a similar situation!",CryptoCurrency,Just paid off my mortgage 20 years early and placed an order for my dream car. Thank you Ethereum!
1612339957,https://www.reddit.com/r/CryptoCurrency/comments/lbiwqs/75_of_all_us_dollars_in_existence_were_printed/,353,860,,CryptoCurrency,75% of all US Dollars in existence were printed after Bitcoin was created
1614894801,https://www.reddit.com/r/CryptoCurrency/comments/lxwg0b/banano_is_the_most_wholesome_coin_in_crypto/,233,194,[removed],CryptoCurrency,Banano is the most wholesome coin in crypto
1614893627,https://www.reddit.com/r/CryptoCurrency/comments/lxw170/sold_my_bitcoin_at_33k/,201,126,I held my half bitcoin through out the crash in 2018 and finally decided to sell it a month ago. I bought at 15.5k and sold at 33k profiting around 10k. I’m now punching myself in the dick. This is what happens when you check them charts every 5 mins and paper hands them. Learn from me friends :) buy coin delete app and forget about it.,CryptoCurrency,Sold my bitcoin at 33k
1612329847,https://www.reddit.com/r/CryptoCurrency/comments/lbgh5p/crypto_for_the_win/,1502,7486,"Well, friends, a little over 7 years on the beautiful rollercoaster of crypto, I finally cashed out all my btc and eth because it's enough to pay off my house + capital gains taxes. I'll be back and rooting for crypto to continue growing and growing, but this was a milestone that I had set for myself and promised my wife if I ever got to this point, I'd pull the trigger. I've never broken a promise and never intend to, so I had to do it.

Great luck to all and hopefully I'll be back in the game sooner than later! Crypto is the future and I know I'm missing out by what I've done, but I'm letting my heart win out over my brain this once to fulfill a lifetime goal.

For anyone curious, I'm just some avg 39 yr old dude in Salt Lake City, UT, USA. Nothing special about me, just lucky and patient. 🙂

I wish you all luck on your journey to the moon and beyond, friends!!!",CryptoCurrency,Crypto for the win!
1612328344,https://www.reddit.com/r/CryptoCurrency/comments/lbg1o1/visa_may_add_cryptocurrencies_to_its_payments/,52,178,,CryptoCurrency,"Visa May Add Cryptocurrencies to Its Payments Network, Says CEO"
